id,tweet_url,created_at,parsed_created_at,user_screen_name,text,tweet_type,coordinates,hashtags,media,urls,favorite_count,in_reply_to_screen_name,in_reply_to_status_id,in_reply_to_user_id,lang,place,possibly_sensitive,retweet_count,retweet_or_quote_id,retweet_or_quote_screen_name,retweet_or_quote_user_id,source,user_id,user_created_at,user_default_profile_image,user_description,user_favourites_count,user_followers_count,user_friends_count,user_listed_count,user_location,user_name,user_statuses_count,user_time_zone,user_urls,user_verified
1103404676047925260,https://twitter.com/newsroomdev/status/1103404676047925260,Wed Mar 06 21:19:09 +0000 2019,2019-03-06 21:19:09+00:00,newsroomdev,"Prepping for #NICAR19 on the plane by watching an extremely informative documentary about real estate corruption in Newport Beach, CA https://t.co/GeRPtW0oXn",original,,NICAR19,https://pbs.twimg.com/media/D1AUsgCXcAwbVTm.jpg,,2,,,,en,,False,0,,,,"<a href=""http://twitter.com/download/iphone"" rel=""nofollow"">Twitter for iPhone</a>",25794883,Sun Mar 22 07:30:42 +0000 2009,False,"Senior developer, news products @axios. PGP https://t.co/qiRs5iIBAy native Houstonian & Gryffindor (according to Pottermore) https://t.co/vAbKyrDdqx",31793,2480,2433,179,"New York, NY",Gerald Rich,13918,,http://axios.com,False
1103404522733359104,https://twitter.com/djordjepadejski/status/1103404522733359104,Wed Mar 06 21:18:33 +0000 2019,2019-03-06 21:18:33+00:00,djordjepadejski,. @BigLocalNews workshop kicks off at #NICAR19!Journalists from local newsrooms around the country are taking a deep dive into police traffic stop data. Go @cephillips and the team! https://t.co/g0vnwYO1Ec,original,,NICAR19,https://pbs.twimg.com/media/D1AUj3MVAAA0WaU.jpg https://pbs.twimg.com/media/D1AUj3MUcAA_kis.jpg https://pbs.twimg.com/media/D1AUj3MVAAEv9-h.jpg,,12,,,,en,,False,6,,,,"<a href=""http://twitter.com/download/iphone"" rel=""nofollow"">Twitter for iPhone</a>",70574113,Tue Sep 01 02:29:07 +0000 2009,False,"@JSKStanford Associate Director, investigative/data journalist, @ICIJorg member, @FOIAMACHINE founder, alum: @CIRonline @OCCRP",3735,1796,1200,157,"Stanford, CA",Djordje Padejski @ #NICAR19,4922,,http://jsk.stanford.edu,True
1103404442114637824,https://twitter.com/pamaples/status/1103404442114637824,Wed Mar 06 21:18:13 +0000 2019,2019-03-06 21:18:13+00:00,pamaples,RT @nikiesnews: Hellooo #NICAR19! Just settling in for the pre-conference Stanford Open Policing Project session and I'm so excited for the…,retweet,,NICAR19,,,0,,,,en,,,1,1103398145940119552,nikiesnews,292518415,"<a href=""https://mobile.twitter.com"" rel=""nofollow"">Twitter Web App</a>",106410773,Tue Jan 19 13:33:28 +0000 2010,False,"Managing director, selection & partnerships @jskstanford. Previous: @stltoday|@newsy|@dalllasnews & some other news orgs no longer w/us.",1225,345,332,12,"Palo Alto, CA",Pam Maples,1350,,http://jsk.stanford.edu,False
1103404265567973376,https://twitter.com/sarhutch/status/1103404265567973376,Wed Mar 06 21:17:31 +0000 2019,2019-03-06 21:17:31+00:00,sarhutch,New swag for #NICAR19! Temporary tattoos of a few of our favorite logos. Look for them scattered around tomorrow. They’re free! https://t.co/ejjTLhyva1,original,,NICAR19,https://pbs.twimg.com/media/D1AUVGrUYAAqZN0.jpg,,16,,,,en,,False,5,,,,"<a href=""http://twitter.com/download/iphone"" rel=""nofollow"">Twitter for iPhone</a>",41435223,Wed May 20 19:56:32 +0000 2009,False,Editorial Director at @IRE_NICAR. Makes the IRE Radio Podcast + IRE Journal magazine 🔎 @VirginianPilot alum 📰 Studying data science at @Mizzou 💻,2773,1967,1025,109,"Columbia, MO",Sarah Hutchins,5714,,http://ire.org,False
1103403882367967232,https://twitter.com/campbellronaldw/status/1103403882367967232,Wed Mar 06 21:16:00 +0000 2019,2019-03-06 21:16:00+00:00,campbellronaldw,And I thought I was ready for #NICAR19. Obviously I'm going to have to take pictures of my cat tonight. #NICAT19 https://t.co/Cp2m2fbhsX,quote,,NICAR19 NICAT19,,https://twitter.com/annalecta/status/1103181213538373632,4,,,,en,,False,0,1103181213538373632,annalecta,792038436,"<a href=""http://twitter.com"" rel=""nofollow"">Twitter Web Client</a>",370264585,Thu Sep 08 18:43:40 +0000 2011,False,Love data and documents. Love writing about them.,1336,484,292,61,"Orange County, CA",Ronald Campbell,475,,http://www.nbcstations.com,False
1103403262026412039,https://twitter.com/ksophiewill/status/1103403262026412039,Wed Mar 06 21:13:32 +0000 2019,2019-03-06 21:13:32+00:00,ksophiewill,"RT @JessicaHuseman: gonna meet my fav twitter people IRL like 

#NICAR19 https://t.co/OmwxzSpnjP",retweet,,NICAR19,https://pbs.twimg.com/tweet_video_thumb/D0_5onOXcAEn_7-.jpg,,0,,,,en,,False,1,1103374919507853312,JessicaHuseman,51781119,"<a href=""https://mobile.twitter.com"" rel=""nofollow"">Twitter Web App</a>",747648734469722113,Tue Jun 28 04:32:03 +0000 2016,False,(UT to MA & BU 2020) Investigative & Data Reporter| Metro @BostonGlobe|Managing @BUNewsService| Fmr. @deseretindepth @NECIRBU| Notebook hoarder|RT ≠ endorsement,6011,515,1930,14,"Boston, MA",K. Sophie Will is new at #NICAR19!,2880,,http://ksophiewill.com,False
1103402596696551433,https://twitter.com/andrewimilligan/status/1103402596696551433,Wed Mar 06 21:10:53 +0000 2019,2019-03-06 21:10:53+00:00,andrewimilligan,Heading to #NICAR19 and the whole TL is people's flights getting cancelled like https://t.co/XM8kEfUTYS,original,,NICAR19,https://pbs.twimg.com/tweet_video_thumb/D1ASzxxWsAIiila.jpg,,0,,,,en,,False,1,,,,"<a href=""http://twitter.com/download/android"" rel=""nofollow"">Twitter for Android</a>",892218849696796672,Tue Aug 01 03:02:05 +0000 2017,False,"Software engineer Breaking News Tools at Bloomberg, in every possible meaning of the phrase",147,40,564,0,"Brooklyn, NY",Andrew Milligan,127,,,False
1103402171897241601,https://twitter.com/mikejcorey/status/1103402171897241601,Wed Mar 06 21:09:12 +0000 2019,2019-03-06 21:09:12+00:00,mikejcorey,For those about to TechRake: 1) We salute you. 2) Here are the slides. #NICAR19 https://t.co/OWtHVpbAP0,original,,NICAR19,,https://tinyurl.com/TRat-NICAR19,5,,,,en,,False,1,,,,"<a href=""https://mobile.twitter.com"" rel=""nofollow"">Twitter Web App</a>",14762108,Tue May 13 17:58:27 +0000 2008,False,"Senior Data Editor for @Reveal. Journalism, science, mapping, history, food. He/him",13869,2946,1281,235,"Emeryville, California USA","Michael Corey, I'm still here.",28731,,http://mikejcorey.com,True
1103401993874403328,https://twitter.com/joemfox/status/1103401993874403328,Wed Mar 06 21:08:30 +0000 2019,2019-03-06 21:08:30+00:00,joemfox,"See you tonight, #nicar19!",original,,nicar19,,,4,,,,en,,,0,,,,"<a href=""http://twitter.com/download/iphone"" rel=""nofollow"">Twitter for iPhone</a>",14816237,Sun May 18 00:40:52 +0000 2008,False,data & weird internet @washingtonpost | ex-@latimes | OH ➡ AK ➡ CA ➡ DC | my bots: @burritopatents @SombreroWatch @andromedabot @colorschemez,20557,3069,1407,155,"Washington, DC",☕🦊 @ #NICAR19,26254,,http://fox.computer,True
1103401945761382400,https://twitter.com/macloo/status/1103401945761382400,Wed Mar 06 21:08:18 +0000 2019,2019-03-06 21:08:18+00:00,macloo,"Yes, please reach out to students at #nicar19 - mine are giving up half their spring break to be here in cold, rainy Newport Beach! #uf https://t.co/PkRtRRBZgb",quote,,nicar19 uf,,https://twitter.com/gaufre/status/1103344101028577280,3,,,,en,,False,0,1103344101028577280,gaufre,12561082,"<a href=""http://twitter.com/download/iphone"" rel=""nofollow"">Twitter for iPhone</a>",2234881,Mon Mar 26 01:43:00 +0000 2007,False,"Digital journalism professor, University of Florida. Rides a Vespa. Travels everywhere. she/her https://t.co/6nrCx90JAT",15924,10664,1057,1425,Florida,Mindy McAdams,24915,,https://github.com/macloo/course-syllabi,False
1103401490994073600,https://twitter.com/DougHaddix/status/1103401490994073600,Wed Mar 06 21:06:30 +0000 2019,2019-03-06 21:06:30+00:00,DougHaddix,"#NICAR19 speakers: Don't forget to send us your materials. 
We're collecting and posting them here: https://t.co/U2g7m4ZMUm https://t.co/oMRXjkbVnn",original,,NICAR19,https://pbs.twimg.com/media/D1AQbdAX4AEahsq.jpg,https://buff.ly/2J2V1P4,2,,,,en,,False,1,,,,"<a href=""https://ifttt.com"" rel=""nofollow"">IFTTT</a>",18215734,Thu Dec 18 14:42:49 +0000 2008,False,Executive Director @ire_nicar | reporter & editor for 20+ years | husband of children's & YA novelist @MPHaddix | proud dad of 2 | @Presbyterian elder,1762,2791,438,229,"Columbus, OH",Doug Haddix,5202,,http://www.ire.org,False
1103400768357298176,https://twitter.com/ithinkifoundyou/status/1103400768357298176,Wed Mar 06 21:03:38 +0000 2019,2019-03-06 21:03:38+00:00,ithinkifoundyou,RT @PamReporting: AZ Data Central to-go! Temporarily relocating from the Sonoran desert to the Pacific coast #NICAR19 @azcentral https://t.…,retweet,,NICAR19,,,0,,,,en,,,6,1103335668871098369,PamReporting,519999873,"<a href=""http://twitter.com"" rel=""nofollow"">Twitter Web Client</a>",1256503784,Sun Mar 10 08:48:17 +0000 2013,True,,19275,382,1598,61,San Fernando Valley,Chatsworth Park,36768,,,False
1103399974354780161,https://twitter.com/IRE_NICAR/status/1103399974354780161,Wed Mar 06 21:00:28 +0000 2019,2019-03-06 21:00:28+00:00,IRE_NICAR,"#NICAR19 speakers: Don't forget to send us your materials. 
We're collecting and posting them here: https://t.co/ZQQ0EnJ5BC https://t.co/4ZxFJ1I5Jg",original,,NICAR19,https://pbs.twimg.com/media/D1AQbdAX4AEahsq.jpg,https://buff.ly/2J2V1P4,2,,,,en,,False,0,,,,"<a href=""https://buffer.com"" rel=""nofollow"">Buffer</a>",12655722,Thu Jan 24 20:31:29 +0000 2008,False,Investigative Reporters and Editors is a nonprofit organization dedicated to improving the quality of investigative reporting.,1150,29296,662,1503,Missouri School of Journalism,IRE and NICAR,6656,,http://www.ire.org,False
1103398745880682501,https://twitter.com/TiffanyAldinger/status/1103398745880682501,Wed Mar 06 20:55:35 +0000 2019,2019-03-06 20:55:35+00:00,TiffanyAldinger,RT @GFTrib_KInbody: Flying into California and #NICAR19 like ... https://t.co/RHnTAJndGm,retweet,,NICAR19,https://pbs.twimg.com/media/D1AIcMuVAAAsKeM.jpg,,0,,,,en,,False,1,1103391194459979776,GFTrib_KInbody,16929297,"<a href=""http://twitter.com"" rel=""nofollow"">Twitter Web Client</a>",729881678,Wed Aug 01 03:34:17 +0000 2012,False,"Recovering journalist/copy editor. Navigating this new world of ""mornings."" Still obsessed with red pens. Still terrible at office pools.",9069,1130,904,43,"Great Falls, Mont.",Tiffany Aldinger,11341,,http://linkedin.com/in/tiffany-aldinger,False
1103398481065111569,https://twitter.com/dataeditor/status/1103398481065111569,Wed Mar 06 20:54:32 +0000 2019,2019-03-06 20:54:32+00:00,dataeditor,"ok let's try this again

iad -&gt; lax #NICAR19",reply,,NICAR19,,,11,dataeditor,1103372013060739077,22816767,en,,,0,,,,"<a href=""http://twitter.com/download/android"" rel=""nofollow"">Twitter for Android</a>",22816767,Wed Mar 04 19:04:48 +0000 2009,False,a complexifier,5106,14123,1058,551,"███████, DC",Steven Rich,18479,,http://www.washingtonpost.com/people/steven-rich,True
1103398163900174336,https://twitter.com/DylanBJackson/status/1103398163900174336,Wed Mar 06 20:53:17 +0000 2019,2019-03-06 20:53:17+00:00,DylanBJackson,"RT @kwashy12: Students, I'd love to hear what topics we should address. Pros, please share any tips and tricks we should know. Swing by Del…",retweet,,,,,0,,,,en,,,1,1103360971005845505,kwashy12,803256312,"<a href=""http://twitter.com/download/iphone"" rel=""nofollow"">Twitter for iPhone</a>",2990622407,Wed Jan 21 21:32:59 +0000 2015,False,"Business reporter at the Daily Business Review • MIZ baby • Writes about lawyers,  Latin America and the intersection of law and politics",3410,419,639,8,"Miami, FL",Dylan Jackson,2678,,http://www.law.com/dailybusinessreview/author/profile/Dylan-Jackson/,False
1103398145940119552,https://twitter.com/nikiesnews/status/1103398145940119552,Wed Mar 06 20:53:12 +0000 2019,2019-03-06 20:53:12+00:00,nikiesnews,Hellooo #NICAR19! Just settling in for the pre-conference Stanford Open Policing Project session and I'm so excited for the next few days! https://t.co/aUMGV6W1IJ,original,,NICAR19,https://pbs.twimg.com/media/D1AOwenVsAA-4Ov.jpg,,10,,,,en,,False,1,,,,"<a href=""http://twitter.com/download/android"" rel=""nofollow"">Twitter for Android</a>",292518415,Tue May 03 19:42:49 +0000 2011,False,"Data journalist for the Southern California News Group. Foodie, hiker, reader, traveler. Retweets are not endorsements.",775,486,503,17,,Nikie Johnson,1985,,,False
1103398130345799693,https://twitter.com/source/status/1103398130345799693,Wed Mar 06 20:53:09 +0000 2019,2019-03-06 20:53:09+00:00,source,Our most recent community call is up now in our audio archive! Listen any time (maybe as you travel to #NICAR19 if you really want to get in the news nerd headspace). https://t.co/7LttfTZAKN,original,,NICAR19,,https://soundcloud.com/opennews/source-community-call-feb-28-2019,0,,,,en,,False,0,,,,"<a href=""https://tapbots.com/software/tweetbot/mac"" rel=""nofollow"">Tweetbot for Mac</a>",587614785,Tue May 22 16:04:22 +0000 2012,False,"Projects and process from teams in newsrooms. Security, transparency, design, ethics. From @OpenNews (incubated @mozilla, project @CommunityPrtnrs).",269,7255,2566,561,,OpenNews Source,1552,,http://source.opennews.org/,False
1103397341829062656,https://twitter.com/Tyson_fraley/status/1103397341829062656,Wed Mar 06 20:50:01 +0000 2019,2019-03-06 20:50:01+00:00,Tyson_fraley,RT @pamaples: I’m looking forward to this discussion— and to seeing friends and JSK alums @ #NICAR19. (PS: I’ve seen the lunch menu—swell.)…,retweet,,NICAR19,,,0,,,,en,,,2,1103391614322372614,pamaples,106410773,"<a href=""http://twitter.com/download/iphone"" rel=""nofollow"">Twitter for iPhone</a>",454534802,Wed Jan 04 03:13:58 +0000 2012,False,NORTH FAIR OAKS/DTX,6894,163,552,3,"Eugene, OR",Tyson,4000,,,False
1103397311068008448,https://twitter.com/Tyson_fraley/status/1103397311068008448,Wed Mar 06 20:49:53 +0000 2019,2019-03-06 20:49:53+00:00,Tyson_fraley,"RT @pamaples: Driving to #NICAR19 would have been faster. Then again, I’d have missed out on the manspreading hyper-leg-jiggling seat mate.",retweet,,NICAR19,,,0,,,,en,,,1,1103393859768406017,pamaples,106410773,"<a href=""http://twitter.com/download/iphone"" rel=""nofollow"">Twitter for iPhone</a>",454534802,Wed Jan 04 03:13:58 +0000 2012,False,NORTH FAIR OAKS/DTX,6894,163,552,3,"Eugene, OR",Tyson,4000,,,False
1103397083011264514,https://twitter.com/zubakskees/status/1103397083011264514,Wed Mar 06 20:48:59 +0000 2019,2019-03-06 20:48:59+00:00,zubakskees,"My plan to not work at #NICAR19, avoid looking like an anti-social workaholic is already facing early turbulence.",original,-77.452426 38.949533,NICAR19,,,2,,,,en,"Virginia, USA",,0,,,,"<a href=""http://tapbots.com/tweetbot"" rel=""nofollow"">Tweetbot for iΟS</a>",15104107,Fri Jun 13 04:11:08 +0000 2008,False,"Data editor @Publici. Coaching a team of computational journalists. Formerly with @SunFoundation, @reportermag.",7518,1723,291,134,"Washington, D.C.",Chris Zubak-Skees,24317,,http://zubak-ske.es/,True
1103396579724079104,https://twitter.com/pamaples/status/1103396579724079104,Wed Mar 06 20:46:59 +0000 2019,2019-03-06 20:46:59+00:00,pamaples,"RT @djordjepadejski: Heya #NICAR19, are you hungry for AI/machine learning examples in journalism? Come to our all-star panel on using AI t…",retweet,,NICAR19,,,0,,,,en,,,6,1102698144553328641,djordjepadejski,70574113,"<a href=""https://mobile.twitter.com"" rel=""nofollow"">Twitter Web App</a>",106410773,Tue Jan 19 13:33:28 +0000 2010,False,"Managing director, selection & partnerships @jskstanford. Previous: @stltoday|@newsy|@dalllasnews & some other news orgs no longer w/us.",1225,345,332,12,"Palo Alto, CA",Pam Maples,1350,,http://jsk.stanford.edu,False
1103395741068750849,https://twitter.com/pamaples/status/1103395741068750849,Wed Mar 06 20:43:39 +0000 2019,2019-03-06 20:43:39+00:00,pamaples,RT @MuckRock: Heading to #NICAR19? Say hi to @morisy and take home one of our snazzy new MuckRock and @documentcloud pins! https://t.co/RE8…,retweet,,NICAR19,,,0,,,,en,,,2,1103026158684250113,MuckRock,124531391,"<a href=""https://mobile.twitter.com"" rel=""nofollow"">Twitter Web App</a>",106410773,Tue Jan 19 13:33:28 +0000 2010,False,"Managing director, selection & partnerships @jskstanford. Previous: @stltoday|@newsy|@dalllasnews & some other news orgs no longer w/us.",1225,345,332,12,"Palo Alto, CA",Pam Maples,1350,,http://jsk.stanford.edu,False
1103395616149843969,https://twitter.com/pamaples/status/1103395616149843969,Wed Mar 06 20:43:09 +0000 2019,2019-03-06 20:43:09+00:00,pamaples,RT @j_la28: Teams are forming now #nicar19 #dataescaperoom https://t.co/V2barj1juT,retweet,,nicar19 dataescaperoom,,https://twitter.com/j_la28/status/1100098625491869698,0,,,,en,,False,2,1103364490165391362,j_la28,242974118,"<a href=""https://mobile.twitter.com"" rel=""nofollow"">Twitter Web App</a>",106410773,Tue Jan 19 13:33:28 +0000 2010,False,"Managing director, selection & partnerships @jskstanford. Previous: @stltoday|@newsy|@dalllasnews & some other news orgs no longer w/us.",1225,345,332,12,"Palo Alto, CA",Pam Maples,1350,,http://jsk.stanford.edu,False
1103394594148868096,https://twitter.com/JenAFifield/status/1103394594148868096,Wed Mar 06 20:39:05 +0000 2019,2019-03-06 20:39:05+00:00,JenAFifield,"“Wow. These are so good. Oh my God.” -@justinJprice, on giant zucchini fries @FarmerBoys #NICAR19 https://t.co/O6DXa8GyIl",original,,NICAR19,https://pbs.twimg.com/media/D1ALiCiVsAMP-CM.jpg,,5,,,,en,"Indio, CA",False,0,,,,"<a href=""http://twitter.com/download/iphone"" rel=""nofollow"">Twitter for iPhone</a>",390156028,Thu Oct 13 15:06:03 +0000 2011,False,"Reporter, The Arizona Republic. 👀 Glendale, Surprise. Alum: https://t.co/Wq1fJM3UkI, @FredNewsPost, https://t.co/sZgX7YU95D, @Cronkite_ASU",1359,2496,1526,101,"Phoenix, AZ",Jen Fifield,9294,,http://www.azcentral.com,True
1103393879762571264,https://twitter.com/morisy/status/1103393879762571264,Wed Mar 06 20:36:15 +0000 2019,2019-03-06 20:36:15+00:00,morisy,RT @pamaples: I’m looking forward to this discussion— and to seeing friends and JSK alums @ #NICAR19. (PS: I’ve seen the lunch menu—swell.)…,retweet,,NICAR19,,,0,,,,en,,,2,1103391614322372614,pamaples,106410773,"<a href=""http://twitter.com/#!/download/ipad"" rel=""nofollow"">Twitter for iPad</a>",6181532,Sun May 20 16:43:11 +0000 2007,False,"Founder and chief executive @MuckRock, helping run @FOIAMachine @DocumentCloud QuackBot @oTranscribe. Board @NFOIC @asapACCESSPRO @CornellSun.",28609,8829,7315,512,"Undisclosed Bunker, Cambridge",Michael Morisy,559,,https://www.muckrock.com,True
1103393859768406017,https://twitter.com/pamaples/status/1103393859768406017,Wed Mar 06 20:36:10 +0000 2019,2019-03-06 20:36:10+00:00,pamaples,"Driving to #NICAR19 would have been faster. Then again, I’d have missed out on the manspreading hyper-leg-jiggling seat mate.",original,,NICAR19,,,10,,,,en,,,1,,,,"<a href=""https://mobile.twitter.com"" rel=""nofollow"">Twitter Web App</a>",106410773,Tue Jan 19 13:33:28 +0000 2010,False,"Managing director, selection & partnerships @jskstanford. Previous: @stltoday|@newsy|@dalllasnews & some other news orgs no longer w/us.",1225,345,332,12,"Palo Alto, CA",Pam Maples,1350,,http://jsk.stanford.edu,False
1103393034799058944,https://twitter.com/NUjournalism/status/1103393034799058944,Wed Mar 06 20:32:54 +0000 2019,2019-03-06 20:32:54+00:00,NUjournalism,"RT @aleszubajak: Announcing our new @NUjournalism publication, Game Plan, exploring the future of sports journalism. Yes, there will be dat…",retweet,,,,,0,,,,en,,,2,1103388086258622465,aleszubajak,36203015,"<a href=""http://twitter.com/download/iphone"" rel=""nofollow"">Twitter for iPhone</a>",92173427,Tue Nov 24 01:56:16 +0000 2009,False,"News, events and announcements from @Northeastern's School of Journalism. Home to @storybench, @gameplanNU and @thescopeNU.",255,1931,594,117,"Boston, MA",NU Journalism,1965,,http://camd.northeastern.edu/journalism,False
1103391731783917568,https://twitter.com/Cezary/status/1103391731783917568,Wed Mar 06 20:27:43 +0000 2019,2019-03-06 20:27:43+00:00,Cezary,Since there is a session on calling bullshit on junk science and fake news at #NICAR19 I’d like to propose this philosophical gem by Harry Frankfurt for a little Nicar reading club. Looking forward to the conference! https://t.co/vXatReGPLk,original,,NICAR19,https://pbs.twimg.com/media/D1AI6KAUwAAqCLr.jpg https://pbs.twimg.com/media/D1AI6KAU4AEy_u6.jpg,,4,,,,en,,False,0,,,,"<a href=""http://twitter.com/download/iphone"" rel=""nofollow"">Twitter for iPhone</a>",15001046,Wed Jun 04 03:51:16 +0000 2008,False,"@WSJ financial investigations team. @ProPublica and @Reuters alum. Data diver, finance geek. Views my own. cezary.podkul@wsj.com / PGP 0x186a257ab948e1be",1213,4168,1699,207,"New York, NY",Cezary Podkul,6631,,http://www.cezarypodkul.com,False
1103391614322372614,https://twitter.com/pamaples/status/1103391614322372614,Wed Mar 06 20:27:15 +0000 2019,2019-03-06 20:27:15+00:00,pamaples,I’m looking forward to this discussion— and to seeing friends and JSK alums @ #NICAR19. (PS: I’ve seen the lunch menu—swell.) https://t.co/o2GKTujDBT,quote,,NICAR19,,https://twitter.com/morisy/status/1102667901885181952,0,,,,en,,False,2,1102667901885181952,morisy,6181532,"<a href=""https://mobile.twitter.com"" rel=""nofollow"">Twitter Web App</a>",106410773,Tue Jan 19 13:33:28 +0000 2010,False,"Managing director, selection & partnerships @jskstanford. Previous: @stltoday|@newsy|@dalllasnews & some other news orgs no longer w/us.",1225,345,332,12,"Palo Alto, CA",Pam Maples,1350,,http://jsk.stanford.edu,False
1103391369232437248,https://twitter.com/LATimesFreshInk/status/1103391369232437248,Wed Mar 06 20:26:17 +0000 2019,2019-03-06 20:26:17+00:00,LATimesFreshInk,"Have you been wondering, say, how many Bens (3), Jacks (2) or Irises (1) from @latimes will be at #NICAR19 this week? 

Use this handy guide from @LATdatadesk to see who's attending the Computer-Assisted Reporting Conference Mar 7-10 in Newport Beach:

https://t.co/zezzO8X4TK",original,,NICAR19,,https://www.latimes.com/projects/nicar19-roster/,0,,,,en,,False,0,,,,"<a href=""http://twitter.com"" rel=""nofollow"">Twitter Web Client</a>",45019295,Fri Jun 05 22:48:28 +0000 2009,False,"News, tidbits & spin from @latimes Communications Department.",8474,4210,1633,157,"El Segundo, CA",LA Times Comms Dept,19308,,http://www.latimes.com/about/la-contact-us-htmlstory.html,False
1103391194459979776,https://twitter.com/GFTrib_KInbody/status/1103391194459979776,Wed Mar 06 20:25:35 +0000 2019,2019-03-06 20:25:35+00:00,GFTrib_KInbody,Flying into California and #NICAR19 like ... https://t.co/RHnTAJndGm,original,,NICAR19,https://pbs.twimg.com/media/D1AIcMuVAAAsKeM.jpg,,10,,,,en,,False,1,,,,"<a href=""http://twitter.com/download/iphone"" rel=""nofollow"">Twitter for iPhone</a>",16929297,Thu Oct 23 16:04:10 +0000 2008,False,"Life reporter for the Great Falls Tribune - author of ""Montana State Parks"" guidebook - Returned @PeaceCorps Volunteer - traveler - farm girl",38880,4563,4198,124,"Great Falls, MT",Kristen Inbody,18015,,http://www.greatfallstribune.com,False
1103389151867662337,https://twitter.com/jennaciccotelli/status/1103389151867662337,Wed Mar 06 20:17:28 +0000 2019,2019-03-06 20:17:28+00:00,jennaciccotelli,"RT @aleszubajak: Announcing our new @NUjournalism publication, Game Plan, exploring the future of sports journalism. Yes, there will be dat…",retweet,,,,,0,,,,en,,,2,1103388086258622465,aleszubajak,36203015,"<a href=""http://twitter.com"" rel=""nofollow"">Twitter Web Client</a>",338127423,Tue Jul 19 03:38:58 +0000 2011,False,"sports @globeschools, proud parent @nuredandblack, always learning @nujournalism. once was @boston25 + @gonuathletics. dream chasin’",6881,720,555,6,"Boston, MA",Jenna Ciccotelli,24057,,,False
1103389082812645376,https://twitter.com/j_la28/status/1103389082812645376,Wed Mar 06 20:17:11 +0000 2019,2019-03-06 20:17:11+00:00,j_la28,RT @macloo: I’m excited to be giving a talk Thursday at #NICAR2019 #nicar19 titled Python 101: An overview for total beginners https://t.co…,retweet,,NICAR2019 nicar19,,,0,,,,en,,,3,1103387948580401152,macloo,2234881,"<a href=""http://twitter.com/download/iphone"" rel=""nofollow"">Twitter for iPhone</a>",242974118,Wed Jan 26 01:03:36 +0000 2011,False,"@irworkshop Proud @reveal & @propublica alum; #data, #disparities, #disabilities; FOIA, felines, faces. jlafleur@irworkshop.org pub key: https://t.co/HBaKkpylyw",2306,4510,1953,375,"Washington, DC",Jennifer LaFleur,6786,,http://investigativereportingworkshop.org,True
1103388467017539584,https://twitter.com/myersjustinc/status/1103388467017539584,Wed Mar 06 20:14:45 +0000 2019,2019-03-06 20:14:45+00:00,myersjustinc,"Excited to see what kinds of great discussions come out of #nicar19! I won't be there this year, but many of my @AP colleagues will. Safe travels, everyone, and I'll see you next year.",original,,nicar19,,,1,,,,en,,,0,,,,"<a href=""http://twitter.com"" rel=""nofollow"">Twitter Web Client</a>",15951714,Fri Aug 22 23:34:28 +0000 2008,False,"Journalist, baker, programmer, crocheter, drone pilot. @AP data journalist and @NewsMediaGuild shop steward. Knows where his towel is. Married to @JuliaJRH.",6675,1943,2264,178,"Chicago, IL",Justin Myers,6230,,https://www.justinmyers.net/,False
