id,tweet_url,created_at,parsed_created_at,user_screen_name,text,tweet_type,coordinates,hashtags,media,urls,favorite_count,in_reply_to_screen_name,in_reply_to_status_id,in_reply_to_user_id,lang,place,possibly_sensitive,retweet_count,retweet_or_quote_id,retweet_or_quote_screen_name,retweet_or_quote_user_id,source,user_id,user_created_at,user_default_profile_image,user_description,user_favourites_count,user_followers_count,user_friends_count,user_listed_count,user_location,user_name,user_statuses_count,user_time_zone,user_urls,user_verified
1103034715123134465,https://twitter.com/byJenAMiller/status/1103034715123134465,Tue Mar 05 20:49:04 +0000 2019,2019-03-05 20:49:04+00:00,byJenAMiller,RT @cbaxter1: Personal news: Thrilled to announce on the eve of #NICAR19 that I’ve accepted an offer to be editor in chief of the new Spotl…,retweet,,NICAR19,,,0,,,,en,,,36,1103034058706161666,cbaxter1,22444140,"<a href=""https://mobile.twitter.com"" rel=""nofollow"">Twitter Web App</a>",14525172,Fri Apr 25 11:24:03 +0000 2008,False,Author of RUNNING: A LOVE STORY. Ultramarathoner. Ultra New Jersian. Bangs on about running for @nytimes. Boss of the #freelancemafia,3262,13544,645,562,"Audubon, N.J.",Jen A. Miller,203987,,http://jenamiller.com,True
1103034519563788290,https://twitter.com/ChrisMegerian/status/1103034519563788290,Tue Mar 05 20:48:17 +0000 2019,2019-03-05 20:48:17+00:00,ChrisMegerian,RT @cbaxter1: Personal news: Thrilled to announce on the eve of #NICAR19 that I’ve accepted an offer to be editor in chief of the new Spotl…,retweet,,NICAR19,,,0,,,,en,,,36,1103034058706161666,cbaxter1,22444140,"<a href=""https://about.twitter.com/products/tweetdeck"" rel=""nofollow"">TweetDeck</a>",31532083,Wed Apr 15 21:48:21 +0000 2009,False,Los Angeles Times reporter in Washington writing about the Russia investigation. Previously covered the 2016 campaign and Sacramento. Former Star-Ledger writer.,2124,29167,1623,1103,"Washington, DC",Chris Megerian,62306,,http://www.latimes.com/la-bio-chris-megerian-staff.html,True
1103034516212461568,https://twitter.com/anna_orso/status/1103034516212461568,Tue Mar 05 20:48:16 +0000 2019,2019-03-05 20:48:16+00:00,anna_orso,RT @cbaxter1: Personal news: Thrilled to announce on the eve of #NICAR19 that I’ve accepted an offer to be editor in chief of the new Spotl…,retweet,,NICAR19,,,0,,,,en,,,36,1103034058706161666,cbaxter1,22444140,"<a href=""https://about.twitter.com/products/tweetdeck"" rel=""nofollow"">TweetDeck</a>",38796851,Sat May 09 04:22:53 +0000 2009,False,Reporter at @phillyinquirer/ @phillydailynews. Penn State alum. Send story ideas and your sickest burns to aorso@phillynews.com.,6974,6199,1217,261,"Philadephia, PA",Anna Orso,15788,,,True
1103034212066553856,https://twitter.com/robertrdenton/status/1103034212066553856,Tue Mar 05 20:47:04 +0000 2019,2019-03-05 20:47:04+00:00,robertrdenton,"Ok, the #NICAR19 FOMO is setting in now... https://t.co/tWDjVbR3su",quote,,NICAR19,,https://twitter.com/JonRMcClure/status/1103034014863159296,4,,,,en,,False,0,1103034014863159296,JonRMcClure,466066119,"<a href=""https://about.twitter.com/products/tweetdeck"" rel=""nofollow"">TweetDeck</a>",185698621,Wed Sep 01 16:33:15 +0000 2010,False,"Digital editor @registerguard. Code, visuals, etc. Views are my own.",3698,1024,749,92,United States,Rob Denton,13172,,http://robertrdenton.com,False
1103034206182129669,https://twitter.com/pkerkstra/status/1103034206182129669,Tue Mar 05 20:47:02 +0000 2019,2019-03-05 20:47:02+00:00,pkerkstra,RT @cbaxter1: Personal news: Thrilled to announce on the eve of #NICAR19 that I’ve accepted an offer to be editor in chief of the new Spotl…,retweet,,NICAR19,,,0,,,,en,,,36,1103034058706161666,cbaxter1,22444140,"<a href=""http://twitter.com"" rel=""nofollow"">Twitter Web Client</a>",24880547,Tue Mar 17 13:27:46 +0000 2009,False,Managing editor for @phillydotcom and @phillyinquirer. Former @Phillymag EIC.,1491,7015,2360,267,Philadelphia,Patrick Kerkstra,7793,,http://Philly.com,True
1103034058706161666,https://twitter.com/cbaxter1/status/1103034058706161666,Tue Mar 05 20:46:27 +0000 2019,2019-03-05 20:46:27+00:00,cbaxter1,Personal news: Thrilled to announce on the eve of #NICAR19 that I’ve accepted an offer to be editor in chief of the new Spotlight PA investigative newsroom being launched by @PhillyInquirer @PittsburghPG and @lnpmediagroup .,original,,NICAR19,,,328,,,,en,,,36,,,,"<a href=""http://twitter.com/download/iphone"" rel=""nofollow"">Twitter for iPhone</a>",22444140,Mon Mar 02 03:15:49 +0000 2009,False,"Soon: Editor in Chief, Spotlight PA. Right now: Editor, Data & Investigations | NJ Advance Media | Tips/Signal 973-943-9130 | cbaxter@njadvancemedia.com",4185,4308,2113,237,"Iselin, NJ",Christopher Baxter hiring @ #NICAR19,6172,,http://projects.nj.com/investigations,True
1103034014863159296,https://twitter.com/JonRMcClure/status/1103034014863159296,Tue Mar 05 20:46:17 +0000 2019,2019-03-05 20:46:17+00:00,JonRMcClure,"cc: #NICAR19

https://t.co/nqt39kLTXr https://t.co/tQaqrC0I5U",original,,NICAR19,https://pbs.twimg.com/media/D07DUUyW0AABVQU.png,https://www.ire.org/events-and-training/event/3433/4216/,5,,,,und,,False,1,,,,"<a href=""http://twitter.com"" rel=""nofollow"">Twitter Web Client</a>",466066119,Tue Jan 17 01:16:46 +0000 2012,False,"Interactive news editor @politico. Previously, @dallasnews, @TheDetailTV, @mujschool, @UniFAU, @KUEnglish. Kansas City, through Texas, east. BBQ widower.",2720,1248,1042,100,"Washington, DC",Jon McClure,4241,,http://www.politico.com,True
1103032942123724800,https://twitter.com/aboutaaron/status/1103032942123724800,Tue Mar 05 20:42:01 +0000 2019,2019-03-05 20:42:01+00:00,aboutaaron,Tony! Toni! Toné! lied to me #NICAR19 https://t.co/nZvB08IDv8,quote,,NICAR19,,https://twitter.com/capitalweather/status/1102986714883280896,1,,,,cs,,False,0,1102986714883280896,capitalweather,15309804,"<a href=""http://twitter.com/download/iphone"" rel=""nofollow"">Twitter for iPhone</a>",14657786,Mon May 05 09:39:35 +0000 2008,False,W.E.B. Du Bois meets Heavy D & the Boyz ✊🏿 Reporter @postgraphics ✊🏿 Hacker @CACivicData ✊🏿 Advisory board @OpenNews ⚡aaron.williams@washpost.com ⚡ Email me.,25543,4803,1235,304,"Chocolate City, USA",Aaron Colby Williams,12478,,https://acwx.net,True
1103032361531301889,https://twitter.com/nancylcoleman/status/1103032361531301889,Tue Mar 05 20:39:42 +0000 2019,2019-03-05 20:39:42+00:00,nancylcoleman,"RT @iff_or: I just wrote a *very* quick post about how to have a great #NICAR19, for folks new to conference-going! Feel free to make your…",retweet,,NICAR19,,,0,,,,en,,,30,1102986999261061120,iff_or,766863587088273408,"<a href=""http://twitter.com"" rel=""nofollow"">Twitter Web Client</a>",4036988353,Tue Oct 27 15:50:26 +0000 2015,False,"Editing at @CoMissourian and @IRE_NICAR | Past stops: @WSJ, @DJNF, @CNN, @TheManeater | @Mizzou '19 | Plays well with words",17835,773,961,15,"Columbia, MO",Nancy Coleman,3711,,http://columbiamissourian.com,False
1103031505620733955,https://twitter.com/nadzhamz/status/1103031505620733955,Tue Mar 05 20:36:18 +0000 2019,2019-03-05 20:36:18+00:00,nadzhamz,"RT @mpetitchou: #NICAR19 attendees! This Saturday at 3:30PM I'll be speaking with @marktfahey, @greenblattmark, @emilygharris, and @nadzham…",retweet,,NICAR19,,,0,,,,en,,,2,1103031180415258624,mpetitchou,359150678,"<a href=""http://twitter.com/download/iphone"" rel=""nofollow"">Twitter for iPhone</a>",244264227,Fri Jan 28 22:40:55 +0000 2011,False,Radio person for KUT 90.5 FM (Austin's NPR Station) _RTs ≠ endorsements,2464,675,1342,18,"Austin, TX",Nadia Hamdan,1448,,,False
1103031180415258624,https://twitter.com/mpetitchou/status/1103031180415258624,Tue Mar 05 20:35:01 +0000 2019,2019-03-05 20:35:01+00:00,mpetitchou,"#NICAR19 attendees! This Saturday at 3:30PM I'll be speaking with @marktfahey, @greenblattmark, @emilygharris, and @nadzhamz about our year-long investigation with @ProPublica @Newsy @reveal into how police depts are inflating rape clearance rates ➡️ https://t.co/DEOJiCTiFI ⬅️",original,,NICAR19,,https://www.ire.org/events-and-training/event/3433/4370/,3,,,,en,,False,2,,,,"<a href=""http://twitter.com"" rel=""nofollow"">Twitter Web Client</a>",359150678,Sun Aug 21 03:14:55 +0000 2011,False,Nerd journalist 🐱 Reporting with data and numbers @ProPublica. 📧: sophie.chou@propublica.org Past: @pritheworld @pewresearch @medialab @Columbia.,3633,1583,1276,74,The Internet,Sophie Chou,1883,,https://twitter.com/mpetitchou,False
1103031058809925632,https://twitter.com/ksophiewill/status/1103031058809925632,Tue Mar 05 20:34:32 +0000 2019,2019-03-05 20:34:32+00:00,ksophiewill,I’m #NewToNICAR! Who else? I’m so excited for Thursday I can’t stand it. #NICAR19 https://t.co/XgVAk8IIHr,quote,,NewToNICAR NICAR19,,https://twitter.com/iff_or/status/1102986999261061120,8,,,,en,,False,1,1102986999261061120,iff_or,766863587088273408,"<a href=""https://mobile.twitter.com"" rel=""nofollow"">Twitter Web App</a>",747648734469722113,Tue Jun 28 04:32:03 +0000 2016,False,(UT to MA & BU 2020) Investigative & Data Reporter| Metro @BostonGlobe|Managing @BUNewsService| Fmr. @deseretindepth @NECIRBU| Notebook hoarder|RT ≠ endorsement,6011,515,1930,14,"Boston, MA",K. Sophie Will is new at #NICAR19!,2880,,http://ksophiewill.com,False
1103029743325233157,https://twitter.com/alexanderrusso/status/1103029743325233157,Tue Mar 05 20:29:18 +0000 2019,2019-03-05 20:29:18+00:00,alexanderrusso,"RT @iff_or: I just wrote a *very* quick post about how to have a great #NICAR19, for folks new to conference-going! Feel free to make your…",retweet,,NICAR19,,,0,,,,en,,,30,1102986999261061120,iff_or,766863587088273408,"<a href=""http://nuzzel.com/"" rel=""nofollow"">Nuzzel</a>",14416109,Thu Apr 17 03:03:41 +0000 2008,False,Award-winning journalist focused on education journalism. More here: @thegrade_. Newsletter signup: https://t.co/CYkFN6hsYr.  Archive: https://t.co/Lf9GmP9LGs,19211,26395,6246,1232,Brooklyn,Alexander,74213,,http://ow.ly/FEbQ30nPPpq,True
1103029519818973184,https://twitter.com/mikejcorey/status/1103029519818973184,Tue Mar 05 20:28:25 +0000 2019,2019-03-05 20:28:25+00:00,mikejcorey,"RT @sarahcnyt: Hey #NICAR19 folks: here’s a tip from another conference. When you’re talking in a group, leave a space open for someone to…",retweet,,NICAR19,,,0,,,,en,,,29,1102998716213092353,sarahcnyt,47387027,"<a href=""http://twitter.com/download/android"" rel=""nofollow"">Twitter for Android</a>",14762108,Tue May 13 17:58:27 +0000 2008,False,"Senior Data Editor for @Reveal. Journalism, science, mapping, history, food. He/him",13869,2946,1281,235,"Emeryville, California USA","Michael Corey, I'm still here.",28731,,http://mikejcorey.com,True
1103029471991361536,https://twitter.com/mikejcorey/status/1103029471991361536,Tue Mar 05 20:28:14 +0000 2019,2019-03-05 20:28:14+00:00,mikejcorey,"RT @iff_or: I just wrote a *very* quick post about how to have a great #NICAR19, for folks new to conference-going! Feel free to make your…",retweet,,NICAR19,,,0,,,,en,,,30,1102986999261061120,iff_or,766863587088273408,"<a href=""http://twitter.com/download/android"" rel=""nofollow"">Twitter for Android</a>",14762108,Tue May 13 17:58:27 +0000 2008,False,"Senior Data Editor for @Reveal. Journalism, science, mapping, history, food. He/him",13869,2946,1281,235,"Emeryville, California USA","Michael Corey, I'm still here.",28731,,http://mikejcorey.com,True
1103027725936353281,https://twitter.com/TWallack/status/1103027725936353281,Tue Mar 05 20:21:17 +0000 2019,2019-03-05 20:21:17+00:00,TWallack,"Still don't quite understand why someone would mail me a CD-ROM with encrypted records, along with a password to access those same records. #FOIA #NICAR19",original,,FOIA NICAR19,,,31,,,,en,"Boston, MA",,0,,,,"<a href=""http://twitter.com"" rel=""nofollow"">Twitter Web Client</a>",135997883,Thu Apr 22 19:16:37 +0000 2010,False,I'm a data journalist and investigative reporter for the Boston Globe.  Slow runner. twallack@globe.com. 617-929-2069. Signal: 6172918123,8155,8466,1844,480,"Boston, MA",Todd Wallack,32755,,http://www.bostonglobe.com/,True
1103026158684250113,https://twitter.com/MuckRock/status/1103026158684250113,Tue Mar 05 20:15:04 +0000 2019,2019-03-05 20:15:04+00:00,MuckRock,Heading to #NICAR19? Say hi to @morisy and take home one of our snazzy new MuckRock and @documentcloud pins! https://t.co/RE8A0okeOG,original,,NICAR19,https://pbs.twimg.com/media/D068chWXcAA6AGS.jpg,,8,,,,en,,False,2,,,,"<a href=""https://buffer.com"" rel=""nofollow"">Buffer</a>",124531391,Fri Mar 19 18:13:26 +0000 2010,False,"MuckRock is the easy way to request, analyze & share public records, making government more transparent and democracies more informed. info@muckrock.com",2144,34148,4419,1264,Coast to Coast,MuckRock,60155,,https://muckrock.com,True
1103026002169520128,https://twitter.com/Marym_Ryan/status/1103026002169520128,Tue Mar 05 20:14:26 +0000 2019,2019-03-05 20:14:26+00:00,Marym_Ryan,"RT @iff_or: I just wrote a *very* quick post about how to have a great #NICAR19, for folks new to conference-going! Feel free to make your…",retweet,,NICAR19,,,0,,,,en,,,30,1102986999261061120,iff_or,766863587088273408,"<a href=""http://twitter.com/download/android"" rel=""nofollow"">Twitter for Android</a>",1592531000,Sun Jul 14 04:30:41 +0000 2013,False,Teaching & nerding out at #NICAR19 | @UCIrvine statistics PhD student | Journalism and statistics @Mizzou grad | stats n cats n stanning public libraries,2486,232,511,15,"Irvine, CA",Mary Ryan,820,,https://statsncats.wordpress.com/,False
1103022907565826053,https://twitter.com/brian_root/status/1103022907565826053,Tue Mar 05 20:02:08 +0000 2019,2019-03-05 20:02:08+00:00,brian_root,So....who's going to #NICAR19 this week?,original,,NICAR19,,,4,,,,en,,,0,,,,"<a href=""http://twitter.com"" rel=""nofollow"">Twitter Web Client</a>",121833630,Wed Mar 10 18:56:13 +0000 2010,False,"Senior Quantitative Analyst at Human Rights Watch - @hrw. Tweeting on methodology, data and human rights research.",74,1403,1201,65,Oakland,Brian Root,2704,,http://www.hrw.org/bios/brian-root,False
1103022311396044801,https://twitter.com/mattwaite/status/1103022311396044801,Tue Mar 05 19:59:46 +0000 2019,2019-03-05 19:59:46+00:00,mattwaite,"RT @sarahcnyt: Hey #NICAR19 folks: here’s a tip from another conference. When you’re talking in a group, leave a space open for someone to…",retweet,,NICAR19,,,0,,,,en,,,29,1102998716213092353,sarahcnyt,47387027,"<a href=""http://twitter.com/download/iphone"" rel=""nofollow"">Twitter for iPhone</a>",8839152,Wed Sep 12 18:53:27 +0000 2007,False,"Journalism Prof. @ U of Nebraska-Lincoln, founder of Drone Journalism Lab, teaching data journalism, developed PolitiFact.",2021,9490,1511,882,,Matt Waite,25906,,http://blog.mattwaite.com/,True
1103020835802103808,https://twitter.com/RuthServen/status/1103020835802103808,Tue Mar 05 19:53:55 +0000 2019,2019-03-05 19:53:55+00:00,RuthServen,"can't attend #NICAR19, but just received a records request and am sorting data into a spreadsheet as a sign of solidarity. Will be looking for your health and higher ed data and investigations tips!",original,,NICAR19,,,4,,,,en,,,0,,,,"<a href=""https://about.twitter.com/products/tweetdeck"" rel=""nofollow"">TweetDeck</a>",1729924585,Wed Sep 04 21:00:13 +0000 2013,False,"Health and higher ed for @DailyProgress. MIZ. Proud Okie. Previously @indystar, @comissourian. Newsletter: https://t.co/8SRCjDngCY.",15552,2390,3767,102,VA | MO | OK,Ruth Serven Smith,18283,,http://servenitup.com/,False
1103020482209685504,https://twitter.com/KassieMcClung/status/1103020482209685504,Tue Mar 05 19:52:30 +0000 2019,2019-03-05 19:52:30+00:00,KassieMcClung,"Ok, #NICAR19 I’m officially headed your way. Let’s grab a drink/coffee. DMs are open, email: kassie@readfrontier.com",original,,NICAR19,,,5,,,,en,,,1,,,,"<a href=""http://twitter.com/download/iphone"" rel=""nofollow"">Twitter for iPhone</a>",318739058,Thu Jun 16 23:55:10 +0000 2011,False,Investigations and enterprise for @readfrontier. Data geek. Signal/WhatsApp: 9189351044 DMs are open.,5743,1874,907,54,"Tulsa, OK",Kassie McClung,5160,,http://readfrontier.org,False
1103019013829877760,https://twitter.com/michaelbolden/status/1103019013829877760,Tue Mar 05 19:46:40 +0000 2019,2019-03-05 19:46:40+00:00,michaelbolden,"RT @djordjepadejski: Heya #NICAR19, are you hungry for AI/machine learning examples in journalism? Come to our all-star panel on using AI t…",retweet,,NICAR19,,,0,,,,en,,,6,1102698144553328641,djordjepadejski,70574113,"<a href=""http://twitter.com/download/iphone"" rel=""nofollow"">Twitter for iPhone</a>",14843435,Tue May 20 10:22:15 +0000 2008,False,Managing Director @JSKstanford | Priors: @knightfdn @washingtonpost @miamiherald | Always:  #Southerner #RollTide 🏳️‍🌈,10918,4451,4468,343,"Stanford, CA",bolden @ stanford,31784,,https://www.linkedin.com/in/michaelbolden,False
1103017621132374016,https://twitter.com/thejqs/status/1103017621132374016,Tue Mar 05 19:41:08 +0000 2019,2019-03-05 19:41:08+00:00,thejqs,"@iff_or Quite welcome. Any questions about any of this, I’ll be findable at #NICAR19.",reply,,NICAR19,,,0,iff_or,1103017300045651968,766863587088273408,en,,,0,,,,"<a href=""https://about.twitter.com/products/tweetdeck"" rel=""nofollow"">TweetDeck</a>",18688794,Tue Jan 06 18:45:22 +0000 2009,False,"Software developer, reporter, editor, occasional teacher. Privately nosy, professionally curious. He/him.",12536,1691,1363,142,Pittsburgh,Jacob Sanders.,58283,,,False
1103017572578951169,https://twitter.com/gradyslady/status/1103017572578951169,Tue Mar 05 19:40:57 +0000 2019,2019-03-05 19:40:57+00:00,gradyslady,RT @ucbsoj: Don't miss Berkeley Journalism lecturer @txtianmiller— an award-winning investigative reporter @ProPublica— at #NICAR19 in Newp…,retweet,,NICAR19,,,0,,,,en,,,4,1100200721482301441,ucbsoj,38748615,"<a href=""http://tapbots.com/tweetbot"" rel=""nofollow"">Tweetbot for iΟS</a>",18250847,Fri Dec 19 20:35:55 +0000 2008,False,RT is not endorsement.  Deep breath and one day at a time.,42495,836,153,1,OR,gradyslady,222576,,,False
1103017221251629056,https://twitter.com/ProPublica/status/1103017221251629056,Tue Mar 05 19:39:33 +0000 2019,2019-03-05 19:39:33+00:00,ProPublica,RT @ucbsoj: Don't miss Berkeley Journalism lecturer @txtianmiller— an award-winning investigative reporter @ProPublica— at #NICAR19 in Newp…,retweet,,NICAR19,,,0,,,,en,,,4,1100200721482301441,ucbsoj,38748615,"<a href=""http://twitter.com/download/iphone"" rel=""nofollow"">Twitter for iPhone</a>",14606079,Wed Apr 30 21:17:15 +0000 2008,False,"Pursuing stories with moral force. Send us things: https://t.co/ujWrcRGO73. Newsletter: https://t.co/PZl6R2m6qR. Also follow @ProPublicaIL. We're there, too.",3811,782536,436,17025,"New York, NY",ProPublica,61555,,http://www.propublica.org/,True
1103015601155371009,https://twitter.com/tkatsume/status/1103015601155371009,Tue Mar 05 19:33:07 +0000 2019,2019-03-05 19:33:07+00:00,tkatsume,"#NICAR19 に参加するため、
今夜シリコンバレーを離脱。
あっという間の2ヶ月だった",original,,NICAR19,,,1,,,,ja,,,0,,,,"<a href=""http://twitter.com/download/iphone"" rel=""nofollow"">Twitter for iPhone</a>",767982606608543744,Tue Aug 23 07:11:36 +0000 2016,False,テレビディレクター ●「みんなで筋肉体操」「発達障害プロジェクト」「あさイチ」●NICAR19 に参加します ●ツイートは全て完全に個人の見解です,903,1577,345,27,"Newport Beach, CA",勝目卓 Takashi Katsume,1437,,,False
1103015308791549952,https://twitter.com/pinardag/status/1103015308791549952,Tue Mar 05 19:31:57 +0000 2019,2019-03-05 19:31:57+00:00,pinardag,"RT @djordjepadejski: Heya #NICAR19, are you hungry for AI/machine learning examples in journalism? Come to our all-star panel on using AI t…",retweet,,NICAR19,,,0,,,,en,,,6,1102698144553328641,djordjepadejski,70574113,"<a href=""http://twitter.com"" rel=""nofollow"">Twitter Web Client</a>",19593365,Tue Jan 27 14:16:33 +0000 2009,False,Data Journalism Lecturer .@khasedutr Co-founder @dagmedyaveri @dagmedyanet @voydorg |PhD cand.| #datajournalism #ddj  #vg #opendata #dataviz #vegan,12025,5423,3574,353,"İstanbul, London, Zürich",Pınar Dağ FirthⓋ,23105,,http://www.khas.edu.tr/3000/biz-kimiz,False
1103014320529534976,https://twitter.com/JSKstanford/status/1103014320529534976,Tue Mar 05 19:28:01 +0000 2019,2019-03-05 19:28:01+00:00,JSKstanford,"RT @djordjepadejski: Heya #NICAR19, are you hungry for AI/machine learning examples in journalism? Come to our all-star panel on using AI t…",retweet,,NICAR19,,,0,,,,en,,,6,1102698144553328641,djordjepadejski,70574113,"<a href=""http://twitter.com/download/iphone"" rel=""nofollow"">Twitter for iPhone</a>",211659408,Wed Nov 03 22:01:44 +0000 2010,False,"JSK supports diverse, resilient leaders with collaborative mindsets who are exploring solutions to journalism’s biggest problems.",7004,8668,1877,422,"Stanford, CA",JSK Fellowships,8726,,http://jsk.stanford.edu/,False
1103011701065015301,https://twitter.com/djordjepadejski/status/1103011701065015301,Tue Mar 05 19:17:37 +0000 2019,2019-03-05 19:17:37+00:00,djordjepadejski,"RT @EvaConstantaras: Random request for #NICAR19. I am running a data journalism program in Jordan starting in April, but a partner NGOs ne…",retweet,,NICAR19,,,0,,,,en,,,13,1102992100507889665,EvaConstantaras,1004614770,"<a href=""http://twitter.com"" rel=""nofollow"">Twitter Web Client</a>",70574113,Tue Sep 01 02:29:07 +0000 2009,False,"@JSKStanford Associate Director, investigative/data journalist, @ICIJorg member, @FOIAMACHINE founder, alum: @CIRonline @OCCRP",3735,1796,1200,157,"Stanford, CA",Djordje Padejski @ #NICAR19,4922,,http://jsk.stanford.edu,True
1103011639383613440,https://twitter.com/djordjepadejski/status/1103011639383613440,Tue Mar 05 19:17:22 +0000 2019,2019-03-05 19:17:22+00:00,djordjepadejski,"RT @sarahcnyt: Hey #NICAR19 folks: here’s a tip from another conference. When you’re talking in a group, leave a space open for someone to…",retweet,,NICAR19,,,0,,,,en,,,29,1102998716213092353,sarahcnyt,47387027,"<a href=""http://twitter.com"" rel=""nofollow"">Twitter Web Client</a>",70574113,Tue Sep 01 02:29:07 +0000 2009,False,"@JSKStanford Associate Director, investigative/data journalist, @ICIJorg member, @FOIAMACHINE founder, alum: @CIRonline @OCCRP",3735,1796,1200,157,"Stanford, CA",Djordje Padejski @ #NICAR19,4922,,http://jsk.stanford.edu,True
1103010575918006272,https://twitter.com/ElizabethRenter/status/1103010575918006272,Tue Mar 05 19:13:08 +0000 2019,2019-03-05 19:13:08+00:00,ElizabethRenter,"Checking out tweets for #NICAR19 and getting excited. Will I meet new people? New friends, even? Stand alone and stare awkwardly at the wall? It could go so many ways!",original,,NICAR19,,,6,,,,en,,,0,,,,"<a href=""https://about.twitter.com/products/tweetdeck"" rel=""nofollow"">TweetDeck</a>",48567055,Fri Jun 19 01:37:08 +0000 2009,False,"Senior writer/data reporter, currently @NerdWallet! I tweet: data, finance, food, stuff & various delightful things. And #FTP.",544,5585,2444,192,"Raleigh, NC",Elizabeth Renter,27033,,http://www.elizabeththewriter.com,True
1103010529365377024,https://twitter.com/pinardag/status/1103010529365377024,Tue Mar 05 19:12:57 +0000 2019,2019-03-05 19:12:57+00:00,pinardag,"RT @IRE_NICAR: The #NICAR19 mobile app is live! Download our @guidebook app to build a custom schedule, connect with other attendees and mo…",retweet,,NICAR19,,,0,,,,en,,,2,1102992283752906753,IRE_NICAR,12655722,"<a href=""http://twitter.com"" rel=""nofollow"">Twitter Web Client</a>",19593365,Tue Jan 27 14:16:33 +0000 2009,False,Data Journalism Lecturer .@khasedutr Co-founder @dagmedyaveri @dagmedyanet @voydorg |PhD cand.| #datajournalism #ddj  #vg #opendata #dataviz #vegan,12025,5423,3574,353,"İstanbul, London, Zürich",Pınar Dağ FirthⓋ,23105,,http://www.khas.edu.tr/3000/biz-kimiz,False
1103010386863828998,https://twitter.com/acoreynews/status/1103010386863828998,Tue Mar 05 19:12:23 +0000 2019,2019-03-05 19:12:23+00:00,acoreynews,"RT @sarahcnyt: Hey #NICAR19 folks: here’s a tip from another conference. When you’re talking in a group, leave a space open for someone to…",retweet,,NICAR19,,,0,,,,en,,,29,1102998716213092353,sarahcnyt,47387027,"<a href=""http://twitter.com/download/iphone"" rel=""nofollow"">Twitter for iPhone</a>",70333841,Mon Aug 31 07:01:04 +0000 2009,False,"Computer Science student #Network+ #Security+ Previously worked as a journalist in SoCal, AZ & NV",3299,1435,5217,118,"Las Vegas, NV",Alex Corey ◤(◕‿◕)◥,8676,,,True
1103010282534854656,https://twitter.com/sarahcnyt/status/1103010282534854656,Tue Mar 05 19:11:58 +0000 2019,2019-03-05 19:11:58+00:00,sarahcnyt,RT @abtran: @sarahcnyt Be like Pac-Man #NICAR19 https://t.co/Lm2MkqnzZG,retweet,,NICAR19,https://pbs.twimg.com/media/D06qgTbXcAAEPXg.jpg,,0,,,,en,,False,5,1103006496655175685,abtran,11670602,"<a href=""http://twitter.com/download/iphone"" rel=""nofollow"">Twitter for iPhone</a>",47387027,Mon Jun 15 17:19:03 +0000 2009,False,"Knight Chair @cronkite_asu; Alum of @nytimes, @washpost , @ire_nicar board. Story ideas and tips to sarah.h.cohen@asu.edu. DMs are open",2868,5666,683,463,"Phoenix, AZ",Sarah Cohen,2677,,https://cronkite.asu.edu/about/faculty-and-leadership/faculty/cohenbio,True
