id,tweet_url,created_at,parsed_created_at,user_screen_name,text,tweet_type,coordinates,hashtags,media,urls,favorite_count,in_reply_to_screen_name,in_reply_to_status_id,in_reply_to_user_id,lang,place,possibly_sensitive,retweet_count,retweet_or_quote_id,retweet_or_quote_screen_name,retweet_or_quote_user_id,source,user_id,user_created_at,user_default_profile_image,user_description,user_favourites_count,user_followers_count,user_friends_count,user_listed_count,user_location,user_name,user_statuses_count,user_time_zone,user_urls,user_verified
1102107275030917120,https://twitter.com/HalukaMB/status/1102107275030917120,Sun Mar 03 07:23:45 +0000 2019,2019-03-03 07:23:45+00:00,HalukaMB,"RT @paldhous: At #NICAR19, I'll be teaching text analysis in the #rstats #tidyverse with #tidytext and #quanteda. You can also play along a…",retweet,,NICAR19 rstats tidyverse tidytext quanteda,,,0,,,,en,,,23,1101922389376479232,paldhous,589535421,"<a href=""http://twitter.com/download/android"" rel=""nofollow"">Twitter for Android</a>",460957118,Wed Jan 11 09:13:29 +0000 2012,False,"News Dev, Data Journalist @nzzvisuals  • messy code, poorly drawn sketches and 😍 for good stories • trained @compjcdf & @IJ_Online / formerly @ft & @zeitonline",6864,1452,1404,124,Zürich - Berlin,Haluka Maier-Borst,4689,,http://maier-borst.de,False
1102071470052634624,https://twitter.com/stiles/status/1102071470052634624,Sun Mar 03 05:01:28 +0000 2019,2019-03-03 05:01:28+00:00,stiles,"Prepping for my #NICAR19 demo, ""data-driven disaster coverage (https://t.co/vDPNqeITVf), reminded me of this old @nprviz tornado project:  https://t.co/b1oJaVS7Un Recreating it step-by-step locally now for the demo. Look familiar, @onyxfish, @alykat @brianboyer? https://t.co/IodWgvaXqX",original,,NICAR19,https://pbs.twimg.com/media/D0tXkQ6U8AAMzfB.jpg,http://bit.ly/2C2GRY3 https://n.pr/2C2GSv5,14,,,,en,,False,0,,,,"<a href=""https://about.twitter.com/products/tweetdeck"" rel=""nofollow"">TweetDeck</a>",14790314,Thu May 15 19:12:30 +0000 2008,False,"Data journalist @latimes. Telling stories about LA County gov’t with words, visuals & code. Former Korea correspondent. Texan. Past: @wsj @NPR @TexasTribune",5280,10504,1462,877,"Los Angeles, CA",Matt Stiles,13163,,http://mattstiles.me,True
1102069254378192897,https://twitter.com/rbvea/status/1102069254378192897,Sun Mar 03 04:52:40 +0000 2019,2019-03-03 04:52:40+00:00,rbvea,"RT @stiles: Just in time for #NICAR19, I stumbled upon this massive toolkit for working with geojson. So many useful utilities here: https:…",retweet,,NICAR19,,,0,,,,en,,,2,1102068004613808129,stiles,14790314,"<a href=""http://twitter.com"" rel=""nofollow"">Twitter Web Client</a>",580191779,Mon May 14 20:03:06 +0000 2012,False,"Map enthusiast. Data wrangler.  Pixel Pusher. Senior Developer at @Atlantic57, digital consultancy of @TheAtlantic.  RT's = bookmarks.",52578,754,1935,144,"Washington, DC",Russell Vea,14697,,https://github.com/rbvea,False
1102068004613808129,https://twitter.com/stiles/status/1102068004613808129,Sun Mar 03 04:47:42 +0000 2019,2019-03-03 04:47:42+00:00,stiles,"Just in time for #NICAR19, I stumbled upon this massive toolkit for working with geojson. So many useful utilities here: https://t.co/mPHL1fsDb2 

Thanks, @tmcw! https://t.co/Zm1JADXFpg",original,,NICAR19,https://pbs.twimg.com/media/D0tUxb0VYAEbb7t.jpg,http://bit.ly/2UgUvOx,15,,,,en,,False,2,,,,"<a href=""https://about.twitter.com/products/tweetdeck"" rel=""nofollow"">TweetDeck</a>",14790314,Thu May 15 19:12:30 +0000 2008,False,"Data journalist @latimes. Telling stories about LA County gov’t with words, visuals & code. Former Korea correspondent. Texan. Past: @wsj @NPR @TexasTribune",5280,10504,1462,877,"Los Angeles, CA",Matt Stiles,13163,,http://mattstiles.me,True
1102065180723347456,https://twitter.com/crit/status/1102065180723347456,Sun Mar 03 04:36:29 +0000 2019,2019-03-03 04:36:29+00:00,crit,"RT @sahilchinoy: Hi students attending #NICAR19 – until very recently, I was one of you. I most definitely cannot get you a job but I can t…",retweet,,NICAR19,,,0,,,,en,,,4,1101881996735901707,sahilchinoy,23888623,"<a href=""http://twitter.com/download/iphone"" rel=""nofollow"">Twitter for iPhone</a>",5712972,Wed May 02 13:17:44 +0000 2007,False,"Work: UT-Austin School of Journalism. Previous: Online Projects and Data editor for the Austin American-Statesman. Life: Outdoor enthusiast, soccer fan, father.",827,1343,720,149,"Austin, TX",Christian McDonald,7855,,http://www.cmcdonald.com/,False
1102050952440352768,https://twitter.com/Jeremy_CF_Lin/status/1102050952440352768,Sun Mar 03 03:39:56 +0000 2019,2019-03-03 03:39:56+00:00,Jeremy_CF_Lin,"RT @sahilchinoy: Hi students attending #NICAR19 – until very recently, I was one of you. I most definitely cannot get you a job but I can t…",retweet,,NICAR19,,,0,,,,en,,,4,1101881996735901707,sahilchinoy,23888623,"<a href=""http://twitter.com/download/iphone"" rel=""nofollow"">Twitter for iPhone</a>",609302983,Fri Jun 15 17:49:56 +0000 2012,False,"台灣人. Visuals, code, words, sass and everything in between @business. @politico, @washingtonpost, @nytimes, @TexasTribune, @ucbsoj alum. I don't play in the NBA.",6036,2241,1780,197,"District of Columbia, USA",Jeremy C.F. Lin 林辰峰,6581,,,False
1102047560297050112,https://twitter.com/CathleenCrowley/status/1102047560297050112,Sun Mar 03 03:26:28 +0000 2019,2019-03-03 03:26:28+00:00,CathleenCrowley,I used #PowerBI to illustrate the long and questionable hours billed by a prosecutor working for two counties. I will be at #NICAR19 along with the @Microsoft Modern Journalism team to give a PowerBI demo. Hope you can join us. https://t.co/aXbzNatdV5,original,,PowerBI NICAR19,,https://www.timesunion.com/news/article/Special-prosecutor-s-bill-time-sheets-raise-13594944.php,0,,,,en,,False,0,,,,"<a href=""http://twitter.com"" rel=""nofollow"">Twitter Web Client</a>",88750132,Mon Nov 09 20:19:21 +0000 2009,False,"Albany Times Union data journalist, web producer and resident data visualization designer.",10,2130,1478,127,"Albany, NY",Cathleen F. Crowley,2015,,https://www.timesunion.com,True
1102044439680335872,https://twitter.com/CathleenCrowley/status/1102044439680335872,Sun Mar 03 03:14:04 +0000 2019,2019-03-03 03:14:04+00:00,CathleenCrowley,@dataeditor I'll be there at #NICAR19 representing @timesunion. Can't wait. I'd love to talk dataviz.,reply,,NICAR19,,,2,dataeditor,1100099905111158784,22816767,en,,,0,,,,"<a href=""http://twitter.com"" rel=""nofollow"">Twitter Web Client</a>",88750132,Mon Nov 09 20:19:21 +0000 2009,False,"Albany Times Union data journalist, web producer and resident data visualization designer.",10,2130,1478,127,"Albany, NY",Cathleen F. Crowley,2015,,https://www.timesunion.com,True
1102026663314051073,https://twitter.com/jorge_pda/status/1102026663314051073,Sun Mar 03 02:03:25 +0000 2019,2019-03-03 02:03:25+00:00,jorge_pda,RT @ucbsoj: Don't miss Gisela Pérez de Acha ('20) &amp; Christi Warren's ('20) 'Rewriting the code of ethics: New standards for digital journal…,retweet,,,,,0,,,,en,,,9,1101676529526833152,ucbsoj,38748615,"<a href=""http://twitter.com/download/iphone"" rel=""nofollow"">Twitter for iPhone</a>",22727775,Wed Mar 04 03:35:39 +0000 2009,False,Associate computational biologist @broadinstitute | Orgullosamente chilango,5050,282,317,2,"Cambridge, MA",Jorge Pérez de Acha,2139,,,False
1102012053202452480,https://twitter.com/TnyWrld/status/1102012053202452480,Sun Mar 03 01:05:22 +0000 2019,2019-03-03 01:05:22+00:00,TnyWrld,"RT @ucbsoj: Don't miss Nausheen Husain ('14)— data reporter @chicagotribune— on two panels at #NICAR19: ""Finding hidden stories in hidden c…",retweet,,NICAR19,,,0,,,,en,,,8,1101925771105296384,ucbsoj,38748615,"<a href=""http://twitter.com/download/iphone"" rel=""nofollow"">Twitter for iPhone</a>",749368588755099648,Sat Jul 02 22:26:09 +0000 2016,False,Authors of Crafting Stories for Virtual Reality / new media company specializing in immersive storytelling. #vr #journalism #360video @lakitalki & @mmbosworth,904,634,2522,39,"California, USA",Tiny World Productions,1850,,http://craftingstoriesforvr.com,False
1102009417019678720,https://twitter.com/islamoyankee/status/1102009417019678720,Sun Mar 03 00:54:54 +0000 2019,2019-03-03 00:54:54+00:00,islamoyankee,"RT @ucbsoj: Don't miss Nausheen Husain ('14)— data reporter @chicagotribune— on two panels at #NICAR19: ""Finding hidden stories in hidden c…",retweet,,NICAR19,,,0,,,,en,,,8,1101925771105296384,ucbsoj,38748615,"<a href=""http://tapbots.com/tweetbot"" rel=""nofollow"">Tweetbot for iΟS</a>",18314266,Mon Dec 22 19:37:06 +0000 2008,False,"There are thousands of ways to kneel and kiss the ground. -Rumi | @ducoexperts | @TrumanProject | Tweets are own. RT≠endorsement
he/him/his",606,5684,1774,183,"New York, NY","Hussein Rashid, PhD",30765,,http://www.husseinrashid.com,False
1101998093892046854,https://twitter.com/ppolitics/status/1101998093892046854,Sun Mar 03 00:09:54 +0000 2019,2019-03-03 00:09:54+00:00,ppolitics,"RT @derekwillis: Hey, #NICAR19 attendees! Want to dig into making the NICAR-L listserv better? We've got a session for that (AND DATA)! Det…",retweet,,NICAR19,,,0,,,,en,,,4,1099801177162727426,derekwillis,14517538,"<a href=""http://twitter.com/download/iphone"" rel=""nofollow"">Twitter for iPhone</a>",96602314,Sun Dec 13 18:49:52 +0000 2009,False,"@Sludge, investigative journalism on money in politics. A newsroom on @Civil. Previously: OpenCongress, AskThem, Councilmatic.",23377,6658,6625,487,"Brooklyn, NY",David Moore,21539,,https://readsludge.com/,False
1101997493154385920,https://twitter.com/JordanOnRecord/status/1101997493154385920,Sun Mar 03 00:07:31 +0000 2019,2019-03-03 00:07:31+00:00,JordanOnRecord,"Trying to finalize my #NICAR19 schedule but the two guys next to me keep yelling ""You're Reindeer Games!"" at each other. Hoping there's a session on deciphering this.",original,,NICAR19,,,1,,,,en,,,0,,,,"<a href=""http://twitter.com/download/android"" rel=""nofollow"">Twitter for Android</a>",3068764060,Tue Mar 03 22:36:40 +0000 2015,False,Digital investigative reporter at @WUSA9. Data. GIS. DC via Indianapolis. American Ninja Warrior. Send news tips to jfischer@wusa9.com.,1818,1435,500,71,"Washington, DC",Jordan Fischer,11454,,http://wusa9.com,False
1101992332344340480,https://twitter.com/cherylwt/status/1101992332344340480,Sat Mar 02 23:47:00 +0000 2019,2019-03-02 23:47:00+00:00,cherylwt,Gearing up for #NICAR19 next week in Newport Beach. Lots of fab hands-on panels and speakers. Join us!,original,,NICAR19,,,21,,,,en,,,2,,,,"<a href=""http://twitter.com/download/iphone"" rel=""nofollow"">Twitter for iPhone</a>",28376929,Thu Apr 02 17:16:33 +0000 2009,False,Investigative correspondent @NPR | Teaching the next generation of journalists @GWU | IRE Board President | @WashPost alum | UIUC grad | Chicago girl | AKA💕💚,188,2771,2067,100,"Washington, DC",Cheryl W. Thompson,3220,,http://www.washingtonpost.com/investigations,False
1101991428216053761,https://twitter.com/kristinhussey1/status/1101991428216053761,Sat Mar 02 23:43:25 +0000 2019,2019-03-02 23:43:25+00:00,kristinhussey1,"I'm making slides for #NICAR19 next week. So far I've clocked an hour and 16 minutes trying to decide which template to use.  

Last year, I pulled an all-nighter to finish my part of the deck. Bet you can guess how that went. https://t.co/OO8oWlGmWo",original,,NICAR19,https://pbs.twimg.com/tweet_video_thumb/D0sOCjnW0AAq1PI.jpg,,5,,,,en,,False,0,,,,"<a href=""http://twitter.com"" rel=""nofollow"">Twitter Web Client</a>",232189184,Thu Dec 30 13:41:17 +0000 2010,False,World’s Longest-Serving Stringer | @McGrawCenter fellow | @IRE_NICAR | WSJ & CapGaz alum | khussey1@gmail.com,9415,1012,1552,46,Connecticut,Kristin Hussey,5299,,https://www.nytimes.com/by/kristin-hussey,False
1101985684922007553,https://twitter.com/derekwillis/status/1101985684922007553,Sat Mar 02 23:20:35 +0000 2019,2019-03-02 23:20:35+00:00,derekwillis,"RT @openelex: If you'll be at #NICAR19 next week, we'll be having a session on Sunday morning. Come and get involved in the project. Some o…",retweet,,NICAR19,,,0,,,,en,,,1,1101985550305771525,openelex,621884390,"<a href=""https://about.twitter.com/products/tweetdeck"" rel=""nofollow"">TweetDeck</a>",14517538,Thu Apr 24 20:48:23 +0000 2008,False,"Journalist with coding habit at @propublica. Hobby: @openelex. Cricket, @PP_Represent & campaign finance. Talk to me: DM for Signal/ derek.willis@propublica.org",20741,21903,1154,1408,"Kensington Oval, ideally",Derek Willis,92388,,http://thescoop.org,True
1101985550305771525,https://twitter.com/openelex/status/1101985550305771525,Sat Mar 02 23:20:03 +0000 2019,2019-03-02 23:20:03+00:00,openelex,"If you'll be at #NICAR19 next week, we'll be having a session on Sunday morning. Come and get involved in the project. Some options:

* Convert precinct-level data
* Standardize data across elections
* Help us plan the future of the project

https://t.co/FfNqi8wPth",original,,NICAR19,,https://www.ire.org/events-and-training/event/3433/4310/,0,,,,en,,False,1,,,,"<a href=""https://about.twitter.com/products/tweetdeck"" rel=""nofollow"">TweetDeck</a>",621884390,Fri Jun 29 13:08:34 +0000 2012,False,The OpenElections Project. Certified election results. For everyone. With @zstumgoren and @derekwillis. openelections@gmail.com,655,4147,508,170,At the precinct level,OpenElections,2994,,http://www.openelections.net,False
1101983648704856067,https://twitter.com/derekwillis/status/1101983648704856067,Sat Mar 02 23:12:30 +0000 2019,2019-03-02 23:12:30+00:00,derekwillis,"RT @derekwillis: Hey, #NICAR19 attendees! Want to dig into making the NICAR-L listserv better? We've got a session for that (AND DATA)! Det…",retweet,,NICAR19,,,0,,,,en,,,4,1099801177162727426,derekwillis,14517538,"<a href=""https://about.twitter.com/products/tweetdeck"" rel=""nofollow"">TweetDeck</a>",14517538,Thu Apr 24 20:48:23 +0000 2008,False,"Journalist with coding habit at @propublica. Hobby: @openelex. Cricket, @PP_Represent & campaign finance. Talk to me: DM for Signal/ derek.willis@propublica.org",20741,21903,1154,1408,"Kensington Oval, ideally",Derek Willis,92388,,http://thescoop.org,True
1101979731908485120,https://twitter.com/yeowoon210/status/1101979731908485120,Sat Mar 02 22:56:56 +0000 2019,2019-03-02 22:56:56+00:00,yeowoon210,"RT @paldhous: At #NICAR19, I'll be teaching text analysis in the #rstats #tidyverse with #tidytext and #quanteda. You can also play along a…",retweet,,NICAR19 rstats tidyverse tidytext quanteda,,,0,,,,en,,,23,1101922389376479232,paldhous,589535421,"<a href=""http://twitter.com/download/iphone"" rel=""nofollow"">Twitter for iPhone</a>",2260968660,Wed Dec 25 03:27:54 +0000 2013,False,data journalism in JoongAng Ilbo,102,103,607,5,"Seoul, South Korea",Yeowoon Bae,786,,http://www.facebook.com/delete210,False
1101975952979042304,https://twitter.com/ceostroff/status/1101975952979042304,Sat Mar 02 22:41:55 +0000 2019,2019-03-02 22:41:55+00:00,ceostroff,"Current status: Pulling memes for #NICAR19 lightning talk while my flight is delayed. Getting some very weary looks at the mix of meme and nerdery from passersby. 

I regret nothing.",original,,NICAR19,,,16,,,,en,,,2,,,,"<a href=""http://twitter.com"" rel=""nofollow"">Twitter Web Client</a>",3044779523,Thu Feb 19 02:49:33 +0000 2015,False,"Data reporter @McClatchyDC, @MiamiHerald, using words, numbers and code. @GirlsWhoCode mentor. Stress baker. costroff@mcclatchydc.com. Always: @TheAlligator.",9653,2416,1252,89,"Miami, FL",Caitlin Ostroff,8817,,https://www.miamiherald.com,False
1101958132283174918,https://twitter.com/kearneymw/status/1101958132283174918,Sat Mar 02 21:31:06 +0000 2019,2019-03-02 21:31:06+00:00,kearneymw,"RT @paldhous: At #NICAR19, I'll be teaching text analysis in the #rstats #tidyverse with #tidytext and #quanteda. You can also play along a…",retweet,,NICAR19 rstats tidyverse tidytext quanteda,,,0,,,,en,,,23,1101922389376479232,paldhous,589535421,"<a href=""https://about.twitter.com/products/tweetdeck"" rel=""nofollow"">TweetDeck</a>",2973406683,Sun Jan 11 17:54:09 +0000 2015,False,"Assistant Professor at @mujschool and MU Informatics Institute. Interested in new media, partisanship, data journalism, data[[""big""]] science, and #rstats.",20555,5087,794,159,"Columbia, MO",Mike Kearney📊,6428,,https://mikewk.com,False
1101954364132986880,https://twitter.com/rtburg/status/1101954364132986880,Sat Mar 02 21:16:08 +0000 2019,2019-03-02 21:16:08+00:00,rtburg,RT @_erinmansfield: Hey folks! I'm thrilled to have been invited to be part of two sessions at #NICAR19. On Thursday @rtburg and I will tal…,retweet,,NICAR19,,,0,,,,en,,,1,1101279194380713984,_erinmansfield,2743157366,"<a href=""http://twitter.com"" rel=""nofollow"">Twitter Web Client</a>",12417022,Fri Jan 18 22:25:16 +0000 2008,False,Data. Engagement. Narrative. Revenue. Now: @uncmjschool. Then: digital editor at @washingtonpost @CQRollCall @USNews.,1809,3558,1984,349,"Chapel Hill, NC",Ryan Thornburg,6250,,,False
1101951401033371653,https://twitter.com/geoffhing/status/1101951401033371653,Sat Mar 02 21:04:21 +0000 2019,2019-03-02 21:04:21+00:00,geoffhing,"RT @ucbsoj: Don't miss Nausheen Husain ('14)— data reporter @chicagotribune— on two panels at #NICAR19: ""Finding hidden stories in hidden c…",retweet,,NICAR19,,,0,,,,en,,,8,1101925771105296384,ucbsoj,38748615,"<a href=""http://twitter.com/download/android"" rel=""nofollow"">Twitter for Android</a>",11360602,Thu Dec 20 03:57:39 +0000 2007,False,"Midwestern hacker/journalist. Data reporter @apmreports. ex @nprviz, @citybureau, @chicagoreporter, @chitribgraphics PGP: https://t.co/ADyUIIJEt2.",13102,1275,1292,97,"Chicago, IL",Geoff Hing,9016,,http://geoff.terrorware.com,False
1101951148699729920,https://twitter.com/SarahHBana/status/1101951148699729920,Sat Mar 02 21:03:21 +0000 2019,2019-03-02 21:03:21+00:00,SarahHBana,"RT @ucbsoj: Don't miss Nausheen Husain ('14)— data reporter @chicagotribune— on two panels at #NICAR19: ""Finding hidden stories in hidden c…",retweet,,NICAR19,,,0,,,,en,,,8,1101925771105296384,ucbsoj,38748615,"<a href=""http://twitter.com/download/android"" rel=""nofollow"">Twitter for Android</a>",16262603,Fri Sep 12 19:57:32 +0000 2008,False,"PhD candidate in Economics at the University of California, Santa Barbara.  Researching various labor economics topics. https://t.co/YC4dy613uf",5943,925,758,26,"Santa Barbara, CA",Sarah Bana,7493,,http://www.sarahbana.com,False
1101948612429430784,https://twitter.com/nausheenhusain/status/1101948612429430784,Sat Mar 02 20:53:17 +0000 2019,2019-03-02 20:53:17+00:00,nausheenhusain,"RT @ucbsoj: Don't miss Nausheen Husain ('14)— data reporter @chicagotribune— on two panels at #NICAR19: ""Finding hidden stories in hidden c…",retweet,,NICAR19,,,0,,,,en,,,8,1101925771105296384,ucbsoj,38748615,"<a href=""http://twitter.com/download/android"" rel=""nofollow"">Twitter for Android</a>",196360757,Tue Sep 28 23:14:26 +0000 2010,False,"@chicagotribune data journalist, developer | @ucbsoj, @nyu_journalism | Datasets discovered serendipitously are my *jam* | nhusain@chicagotribune.com | She/Her",2098,1552,1424,102,"Chicago, IL",Nausheen Husain,9600,,http://nausheenhusain.wordpress.com/clips,False
1101930786729742342,https://twitter.com/Sahelanth/status/1101930786729742342,Sat Mar 02 19:42:27 +0000 2019,2019-03-02 19:42:27+00:00,Sahelanth,"RT @paldhous: At #NICAR19, I'll be teaching text analysis in the #rstats #tidyverse with #tidytext and #quanteda. You can also play along a…",retweet,,NICAR19 rstats tidyverse tidytext quanteda,,,0,,,,en,,,23,1101922389376479232,paldhous,589535421,"<a href=""http://twitter.com"" rel=""nofollow"">Twitter Web Client</a>",2550725251,Fri Jun 06 18:37:02 +0000 2014,False,Medical/ science writer. I love #rstats.,391088,1200,602,290,"New York, NY",James Pitt,48603,,https://github.com/Sahelanth/,False
1101927745292910592,https://twitter.com/paldhous/status/1101927745292910592,Sat Mar 02 19:30:21 +0000 2019,2019-03-02 19:30:21+00:00,paldhous,"RT @ucbsoj: Don't miss @ucbsoj lecturer @paldhous @BuzzFeedNews — on 'Text mining in R with tidytext' panel at #NICAR19 Thursday, Mar. 7 at…",retweet,,NICAR19,,,0,,,,en,,,2,1101927556867997696,ucbsoj,38748615,"<a href=""http://twitter.com"" rel=""nofollow"">Twitter Web Client</a>",589535421,Thu May 24 21:53:47 +0000 2012,False,"Science. Data. Journalism. Maps. Reporter @BuzzFeedNews, lecturer @UCSC_SciCom @ucbsoj, instructor @AMI_Berkeley",366,7565,2333,580,San Francisco,Peter Aldhous,12934,,https://www.peteraldhous.com,False
1101927556867997696,https://twitter.com/ucbsoj/status/1101927556867997696,Sat Mar 02 19:29:37 +0000 2019,2019-03-02 19:29:37+00:00,ucbsoj,"Don't miss @ucbsoj lecturer @paldhous @BuzzFeedNews — on 'Text mining in R with tidytext' panel at #NICAR19 Thursday, Mar. 7 at 11:30am: https://t.co/0qMPiwgvgp. #proud @UCBerkeley https://t.co/hUhlD0LSc8",original,,NICAR19 proud,https://pbs.twimg.com/media/D0rUzmrU4AAdjWL.jpg,https://bit.ly/2H9z8Lb,4,,,,en,,False,2,,,,"<a href=""http://twitter.com"" rel=""nofollow"">Twitter Web Client</a>",38748615,Fri May 08 23:32:53 +0000 2009,False,Official feed for the UC Berkeley Graduate School of Journalism.,13140,8932,2275,569,"Berkeley, CA",UC Berkeley J-School,16472,,http://journalism.berkeley.edu/,True
1101926985247453186,https://twitter.com/rstats4ds/status/1101926985247453186,Sat Mar 02 19:27:20 +0000 2019,2019-03-02 19:27:20+00:00,rstats4ds,"RT @paldhous: At #NICAR19, I'll be teaching text analysis in the #rstats #tidyverse with #tidytext and #quanteda. You can also play along a…",retweet,,NICAR19 rstats tidyverse tidytext quanteda,,,0,,,,en,,,23,1101922389376479232,paldhous,589535421,"<a href=""https://github.com/lina2497/"" rel=""nofollow"">R stats API access</a>",1075011651366199297,Tue Dec 18 12:55:25 +0000 2018,False,Interested in using #Rstats for #DataScience. A bot maintained by @AlexBetts. Retweets are not endorsements. Suggestions welcome!,5627,434,0,8,,R for Data Science,5627,,,False
1101925771105296384,https://twitter.com/ucbsoj/status/1101925771105296384,Sat Mar 02 19:22:31 +0000 2019,2019-03-02 19:22:31+00:00,ucbsoj,"Don't miss Nausheen Husain ('14)— data reporter @chicagotribune— on two panels at #NICAR19: ""Finding hidden stories in hidden communities"" and ""Covering immigration with data"" | March 8 in Newport Beach, CA: https://t.co/pQbsPhLrX7 https://t.co/shFjRV1Oto. #proud @UCBerkeley https://t.co/CLoEkLck7V",original,,NICAR19 proud,https://pbs.twimg.com/media/D0rS6eEVsAAKlQV.jpg,https://bit.ly/2GUVwIU https://bit.ly/2SzvoEZ,39,,,,en,,False,8,,,,"<a href=""http://twitter.com"" rel=""nofollow"">Twitter Web Client</a>",38748615,Fri May 08 23:32:53 +0000 2009,False,Official feed for the UC Berkeley Graduate School of Journalism.,13140,8932,2275,569,"Berkeley, CA",UC Berkeley J-School,16472,,http://journalism.berkeley.edu/,True
1101922645325492224,https://twitter.com/MuKaoKai/status/1101922645325492224,Sat Mar 02 19:10:06 +0000 2019,2019-03-02 19:10:06+00:00,MuKaoKai,"RT @paldhous: At #NICAR19, I'll be teaching text analysis in the #rstats #tidyverse with #tidytext and #quanteda. You can also play along a…",retweet,,NICAR19 rstats tidyverse tidytext quanteda,,,0,,,,en,,,23,1101922389376479232,paldhous,589535421,"<a href=""https://mobile.twitter.com"" rel=""nofollow"">Twitter Web App</a>",2899772220,Sat Nov 15 00:34:30 +0000 2014,False,"無顔会〜NeoAntiNeoism 〜Cut-rate Cultural Terrorism〜Corrective Phrenology〜Taima Shintō~NOT an ""artificial intelligence"", pinky-swear!",16063,251,264,7,"Tokyo-to, Japan",オチャッピイANON!,18232,,,False
1101922389376479232,https://twitter.com/paldhous/status/1101922389376479232,Sat Mar 02 19:09:05 +0000 2019,2019-03-02 19:09:05+00:00,paldhous,"At #NICAR19, I'll be teaching text analysis in the #rstats #tidyverse with #tidytext and #quanteda. You can also play along at home, notes here. (LMK if you see any glitches!)
https://t.co/8ibRPU1pKr https://t.co/9k6TkJYn6M",original,,NICAR19 rstats tidyverse tidytext quanteda,https://pbs.twimg.com/media/D0rQf2iUwAA1Otd.jpg,https://paldhous.github.io/NICAR/2019/r-text-analysis.html,90,,,,en,,False,23,,,,"<a href=""http://twitter.com"" rel=""nofollow"">Twitter Web Client</a>",589535421,Thu May 24 21:53:47 +0000 2012,False,"Science. Data. Journalism. Maps. Reporter @BuzzFeedNews, lecturer @UCSC_SciCom @ucbsoj, instructor @AMI_Berkeley",366,7565,2333,580,San Francisco,Peter Aldhous,12934,,https://www.peteraldhous.com,False
1101921706464014336,https://twitter.com/paldhous/status/1101921706464014336,Sat Mar 02 19:06:22 +0000 2019,2019-03-02 19:06:22+00:00,paldhous,RT @abtran: I’m not saying that you should attend the day-long hands-on tidyverse session next week at #NICAR19 by @akesslerdc @olgapierce…,retweet,,NICAR19,,,0,,,,en,,,8,1101573390249406467,abtran,11670602,"<a href=""http://twitter.com"" rel=""nofollow"">Twitter Web Client</a>",589535421,Thu May 24 21:53:47 +0000 2012,False,"Science. Data. Journalism. Maps. Reporter @BuzzFeedNews, lecturer @UCSC_SciCom @ucbsoj, instructor @AMI_Berkeley",366,7565,2333,580,San Francisco,Peter Aldhous,12934,,https://www.peteraldhous.com,False
1101917785079382016,https://twitter.com/Sari_Lesk/status/1101917785079382016,Sat Mar 02 18:50:47 +0000 2019,2019-03-02 18:50:47+00:00,Sari_Lesk,RT @jcstearns: Just in time for #NICAR19 https://t.co/7o4WNEg3Hu,retweet,,NICAR19,,https://twitter.com/verge/status/1101542213027328000,0,,,,en,,False,1,1101625616988807168,jcstearns,14302121,"<a href=""http://twitter.com/download/iphone"" rel=""nofollow"">Twitter for iPhone</a>",535525706,Sat Mar 24 17:08:19 +0000 2012,False,Reporter @MKEBizJournal. Formerly @Journaltimes & @Stevenspointjrl. Maker of obscure references. RTs≠endorsements. IG: S.Lesk | Tips: slesk@bizjournals.com,960,672,855,52,,Sari Lesk,9169,,http://www.sarilesk.com,False
